{
  "$schema": "https://antigravity.google/schemas/security-audit/evidence-matrix.schema.json",
  "schemaVersion": "1.0.0",
  "generatedAt": "2026-09-22T15:11:01.485Z",
  "targetSystem": "@arcobaleno64/agy-security-audit",
  "version": "1.7.2",
  "governance": {
    "standard": "NIST SSDF (SP 800-218) / Default-Deny Authority Invariant",
    "covenant": "Section 21 Holdout Covenant & v1.6.1 Evidence Integrity Correction",
    "provenancePolicy": "Strict Fail-Closed: synthetic fixtures must never be represented as live model observations.",
    "lastEvaluatedAt": "2026-09-24T00:18:53.394Z"
  },
  "summary": {
    "totalDimensions": 5,
    "supportedDimensions": 5,
    "partiallyHoldsDimensions": 0,
    "reopenedDimensions": 0,
    "provisionalDimensions": 0,
    "overallStatus": "SUBSTANTIATED"
  },
  "dimensions": {
    "DETERMINISTIC_HARNESS": {
      "status": "SUPPORTED",
      "grade": "L1",
      "claim": "121 automated release invariants and G6 19 runtime confinement vectors verified green in deterministic CI harness.",
      "scope": "121 automated invariants, G6 19 vectors",
      "verificationMethod": "Deterministic automated test runner and invariant assertions (skills/security-audit/scripts/render-sarif.mjs --test).",
      "artifacts": [
        {
          "path": "skills/security-audit/scripts/render-sarif.mjs",
          "sha256": "ba633aa20be99725f668b552296b40835564e05d527b738f204c8342b2783464",
          "description": "Canonical SARIF renderer and 121 automated release invariants test suite"
        },
        {
          "path": "skills/security-audit/scripts/check-release-invariants.mjs",
          "sha256": "d9880ab1e3f51b87d2ae0859c40f32e06dfa9285466967196ac1e946ce57df7d",
          "description": "Release Invariants Gate specification checker (60 specs, 40 security invariants)"
        },
        {
          "path": "skills/security-audit/tool-integrity-manifest.json",
          "sha256": "8c5967335180369df8a3dd9380942dbf42b2438b33b9a7567773a54a6dc437e9",
          "description": "Cryptographic TCB integrity manifest pinning critical script hashes"
        },
        {
          "path": "scripts/test-runtime-confinement.mjs",
          "sha256": "6dcf7552c5688cd41c57e1c6973e6d393804092f45e1cf7543078966e65e1bad",
          "description": "Deterministic test suite verifying all 5 G6 runtime confinement controls"
        },
        {
          "path": "reports/runtime-confinement-report-2026-09-22.md",
          "sha256": "9619e5e4bca4d63ace312c89d4013d089ecb51ade651259ee56e33a91f1c0caf",
          "description": "Dual-Control Runtime Confinement Matrix Report (Milestone G6)"
        },
        {
          "path": "schemas/evidence-matrix.schema.json",
          "sha256": "16e44a97ad155fd63bc679100adb367bb6ec3653ad557a5dd861c863ff806c9d",
          "description": "Draft-07 JSON Schema defining the authoritative evidence matrix specification"
        }
      ]
    },
    "LIVE_MODEL_EVALUATION": {
      "status": "SUPPORTED",
      "grade": "L2",
      "claim": "G4/G5 label-blind hermetic live evaluation across 20 holdout benchmark fixtures over 5 passes.",
      "scope": "G4/G5 label-blind hermetic live evaluation",
      "verificationMethod": "Label-blind projection in hermetic sandbox with empirical N=5 pass recording and holdout oracle reconciliation.",
      "artifacts": [
        {
          "path": "evals/semantic-benchmark/ground-truth.json",
          "sha256": "8aacd40bb4e8a01053ca98c686d903e362802aefbb660c97b806b4d2e3f78228",
          "description": "Authoritative 20-fixture paired ground-truth dataset"
        },
        {
          "path": "evals/holdout-benchmark/ground-truth.json",
          "sha256": "77e6d7a71de9ad90fa848373a026041093800d5fce271d624ff184634ced66de",
          "description": "Authoritative 20-fixture paired holdout generalization dataset"
        },
        {
          "path": "reports/empirical-baseline-n5-report-2026-09-13.md",
          "sha256": "a294eab1cbf6b27d50ffc7e9cf0f17d76a11c4d9cb15dceeb29780cff4dd573a",
          "description": "Authentic N=5 Model Discovery Baseline Report"
        },
        {
          "path": "reports/safe-control-baseline-report-2026-09-17.md",
          "sha256": "156c60ea14729dab3678021c0785926de2292971389cc9cc979f946cde0067e4",
          "description": "Authentic Label-Blind Safe-Control Baseline Report"
        },
        {
          "path": "reports/reasoning-ablation-report-2026-09-17-corrected.md",
          "sha256": "8180d8f57588e0155b240957fceac69964d519f3fa3cd419bae2871c9bccedfa",
          "description": "Corrected Reasoning Profile Ablation Report (Milestone G5)"
        },
        {
          "path": "evals/live-runs/run-pass-1.json",
          "sha256": "a5a300198783a2b6e3c2ee5e0ca5441757eb7160f2a3db13b6c8663b5d2cd61f",
          "description": "Authentic MODEL_OBSERVED live run pass 1 envelope"
        },
        {
          "path": "evals/live-runs/run-pass-2.json",
          "sha256": "e9519063b7b333b9ebf4fe0ddb9df6898dc2d8b0f132dad2bbfec925b1a86644",
          "description": "Authentic MODEL_OBSERVED live run pass 2 envelope"
        },
        {
          "path": "evals/live-runs/run-pass-3.json",
          "sha256": "d976983b15e5303ba791984c8fea2b9b6f4b9382775997c966fd126fd32f37af",
          "description": "Authentic MODEL_OBSERVED live run pass 3 envelope"
        },
        {
          "path": "evals/live-runs/run-pass-4.json",
          "sha256": "c1690cdf1e49a6324fcfe6017e99f6f8dc6be4727e7b36afe75264036a5195a3",
          "description": "Authentic MODEL_OBSERVED live run pass 4 envelope"
        },
        {
          "path": "evals/live-runs/run-pass-5.json",
          "sha256": "921fac2871f25f045de8d748498f5b96e43f3f194a1cb582a13bcbe7a78cb431",
          "description": "Authentic MODEL_OBSERVED live run pass 5 envelope"
        }
      ]
    },
    "LIVE_RUNTIME_ENFORCEMENT": {
      "status": "SUPPORTED",
      "grade": "L2_OBSERVED_RUNTIME",
      "claim": "Five runtime confinement controls enforced fail-closed under PreToolUse hook telemetry.",
      "scope": "DEFINED_FIVE_CONTROL_CANARY",
      "verificationMethod": "Canary agent interception via hooks/shadow-context-guard.mjs with out-of-band telemetry logging.",
      "artifacts": [
        {
          "path": "hooks/shadow-context-guard.mjs",
          "sha256": "ac640a24184c731fcb1fa8adf4ccbd0d5b40f17d8789149ccbdeb670dc2e61c0",
          "description": "PreToolUse hook enforcing shadow context redirection and runtime confinement"
        },
        {
          "path": "scripts/run-runtime-canary.mjs",
          "sha256": "92387d292b1040c72582ee41ad449994d47c6933ff50a94684c06f63cca98882",
          "description": "Milestone G6-L2 Live Runtime Canary Verification Engine"
        },
        {
          "path": "reports/runtime-canary-report-2026-09-22.md",
          "sha256": "f5b7393d1ca190c137ffe8d09273a51be7cdd20eb784a88e4a86fa021e69c433",
          "description": "Live Runtime Confinement Canary Report (Milestone G6-L2)"
        }
      ]
    },
    "CROSS_PROVIDER_REPLICATION": {
      "status": "SUPPORTED",
      "grade": "L3_CROSS_PROVIDER_OBSERVED",
      "claim": "Milestone G8-R contemporaneous interleaved live replication across Google Antigravity (gemini-3.8-flash) and Anthropic Claude Code (claude-sonnet-5) verified under hermetic isolation with raw stream cryptographic attestation.",
      "scope": "CROSS_PROVIDER_MODEL_REPLICATION",
      "verificationMethod": "Contemporaneous interleaved live agent execution (A1 -> B1 -> A2 -> B2 -> A3 -> B3) across 20 holdout fixtures with raw stream NDJSON retention, runtime identity attestation, and censored exposure accounting.",
      "artifacts": [
        {
          "path": "reports/cross-provider-replication-report-2026-09-23.md",
          "sha256": "40791bebf5de7d06c8fd4157a48694f82b69068cf836d800280520cd8a47942c",
          "description": "Cross-Provider Model Replication Report (Milestone G8-R)"
        },
        {
          "path": "evals/protocols/v1.6-g8r-cross-provider-protocol.json",
          "sha256": "894aba704d1e1a1aedfc38aa834822f9ea2fa3ac811c2aec865a9350ff4fea33",
          "description": "Frozen Evaluation Protocol Specification (Milestone G8-R)"
        },
        {
          "path": "evals/live-runs/cross-provider/gemini/run-pass-1.json",
          "sha256": "e4a5da6672160ac9dbb9d943e2e966c012489b7c59a4ace68f68dc3c9d33f082",
          "description": "Authentic MODEL_OBSERVED Gemini live run pass 1 envelope"
        },
        {
          "path": "evals/live-runs/cross-provider/gemini/raw-stream-pass-1.jsonl",
          "sha256": "3383f1d6b325e2375ee0f258cb5006b8e01fba79afe00293ce312869a8edba12",
          "description": "Cryptographically attested raw stdout stream for Gemini pass 1"
        },
        {
          "path": "evals/live-runs/cross-provider/gemini/run-pass-2.json",
          "sha256": "1866e72813454eb0f6b31b9150b28fca82ba9e9fafeaca4c737f9d15041d54a4",
          "description": "Authentic MODEL_OBSERVED Gemini live run pass 2 envelope"
        },
        {
          "path": "evals/live-runs/cross-provider/gemini/raw-stream-pass-2.jsonl",
          "sha256": "c5b868efea30084db340b5282d7a74a4f3ed06e602f6eb3d6f6f984439d65115",
          "description": "Cryptographically attested raw stdout stream for Gemini pass 2"
        },
        {
          "path": "evals/live-runs/cross-provider/gemini/run-pass-3.json",
          "sha256": "34652fbaac61fe58afcb51cca951e42f834ccf94f14b56a99bd6ebbd785e1a33",
          "description": "Authentic MODEL_OBSERVED Gemini live run pass 3 envelope"
        },
        {
          "path": "evals/live-runs/cross-provider/gemini/raw-stream-pass-3.jsonl",
          "sha256": "ca4225e8d24a00c8922a8bc71c32936528871eba1655b74e12feeaa523182a17",
          "description": "Cryptographically attested raw stdout stream for Gemini pass 3"
        },
        {
          "path": "evals/live-runs/cross-provider/claude/run-pass-1.json",